{
    "parent": "builtin/generated",
    "ambientocclusion": true,
    "display": {
        "thirdperson_righthand": {
            "rotation": [0, 0, 0],
            "translation": [0, 0, 0],
            "scale": [0, 0, 0]
        }
    },
    "textures": {
        "particle": "minecraft:block/dirt",
        "variable": "minecraft:block/dirt"
    },
    "elements": [
        {
            "from": [0, 0, 0],
            "to": [0, 0, 0],
            "rotation": {
                "origin": [0, 0, 0],
                "axis": "x",
                "angle": 22.5,
                "rescale": true
            },
            "shade": true,
            "faces": {
                "up": {
                    "uv": [0, 0, 1, 1],
                    "texture": "#variable",
                    "cullface": "up",
                    "rotation": 0,
                    "tintindex": 0
                }
            }
        }
    ]
}
